{
  "schema_version": "chesstory.move-review.engine-work-report.v5",
  "engine_profile": "sf18-smallnet-t2-h16-v1",
  "work_id": "work:0",
  "outcome": {
    "kind": "completed",
    "line_suffixes": [
      {
        "moves": ["g1f3"],
        "depth": 16,
        "white_score": {"kind": "cp", "value": 20}
      }
    ]
  }
}
